UC1
 CREATE DATABASE payroll_service;
Query OK, 1 row affected (1.66 sec)

mysql> show databases;
+--------------------+
| Database           |
+--------------------+
| information_schema |
| mysql              |
| payroll_service    |
| performance_schema |
| sys                |
+--------------------+
5 rows in set (0.98 sec)

mysql> USE payroll_service;
Database changed
mysql> SELECT DATABASE();
+-----------------+
| DATABASE()      |
+-----------------+
| payroll_service |
+-----------------+
1 row in set (0.00 sec)
UC2:
CREATE TABLE employee_payroll
    -> (
    -> id               Int unsigned NOT NULL AUTO_INCREMENT,     #Unique ID for the record
    -> name             VARCHAR(150) NOT NULL,                    #Name of the Employee
    -> salary           Double NOT NULL,                          #Employee Salary
    -> start            DATE NOT NULL,                            #Employee Start Date
    -> PRIMARY KEY      (id)                                      #Make id primary key
    -> );
Query OK, 0 rows affected (2.08 sec)

mysql> DESCRIBE employee_payroll;
+--------+--------------+------+-----+---------+----------------+
| Field  | Type         | Null | Key | Default | Extra          |
+--------+--------------+------+-----+---------+----------------+
| id     | int unsigned | NO   | PRI | NULL    | auto_increment |
| name   | varchar(150) | NO   |     | NULL    |                |
| salary | double       | NO   |     | NULL    |                |
| start  | date         | NO   |     | NULL    |                |
+--------+--------------+------+-----+---------+----------------+
4 rows in set (0.22 sec)

UC3:
mysql> INSERT INTO employee_payroll ( name, salary, start) VALUES
    -> ( 'Bill', 100000.00, '2018-01-03' ),
    -> ( 'Terisa', 200000.00, '2019-11-13' ),
    -> ( 'Charlie', 300000.00, '2020-05-21' );
Query OK, 3 rows affected (0.23 sec)
Records: 3  Duplicates: 0  Warnings: 0

mysql> SELECT * FROM employee_payroll;
+----+---------+--------+------------+
| id | name    | salary | start      |
+----+---------+--------+------------+
|  1 | Bill    | 100000 | 2018-01-03 |
|  2 | Terisa  | 200000 | 2019-11-13 |
|  3 | Charlie | 300000 | 2020-05-21 |
+----+---------+--------+------------+
3 rows in set (0.04 sec)

UC4:
mysql> SELECT * FROM employee_payroll
    -> WHERE start BETWEEN CAST('2018-01-01' AS DATE) AND DATE(NOW());
+----+---------+--------+------------+
| id | name    | salary | start      |
+----+---------+--------+------------+
|  1 | Bill    | 100000 | 2018-01-03 |
|  2 | Terisa  | 200000 | 2019-11-13 |
|  3 | Charlie | 300000 | 2020-05-21 |
+----+---------+--------+------------+
3 rows in set (0.07 sec)

mysql> SELECT * FROM employee_payroll
    -> WHERE start BETWEEN CAST('2019-01-01' AS DATE) AND DATE(NOW());
+----+---------+--------+------------+
| id | name    | salary | start      |
+----+---------+--------+------------+
|  2 | Terisa  | 200000 | 2019-11-13 |
|  3 | Charlie | 300000 | 2020-05-21 |
+----+---------+--------+------------+
2 rows in set (0.00 sec)

UC5:
 ALTER TABLE employee_payroll ADD gender CHAR(1) AFTER name;
Query OK, 0 rows affected (2.98 sec)
Records: 0  Duplicates: 0  Warnings: 0

mysql> describe employee_payroll
    -> describe employee_payroll;
ERROR 1064 (42000): You have an error in your SQL syntax; check the manual that corresponds to your MySQL server version for the right syntax to use near 'describe employee_payroll' at line 2
mysql> describe employee_payroll;
+--------+--------------+------+-----+---------+----------------+
| Field  | Type         | Null | Key | Default | Extra          |
+--------+--------------+------+-----+---------+----------------+
| id     | int unsigned | NO   | PRI | NULL    | auto_increment |
| name   | varchar(150) | NO   |     | NULL    |                |
| gender | char(1)      | YES  |     | NULL    |                |
| salary | double       | NO   |     | NULL    |                |
| start  | date         | NO   |     | NULL    |                |
+--------+--------------+------+-----+---------+----------------+
5 rows in set (0.09 sec)

mysql> update employee_payroll set gender = 'F' where name = 'Terisa';
Query OK, 1 row affected (0.10 sec)
Rows matched: 1  Changed: 1  Warnings: 0

mysql> SELECT * FROM employee_payroll;
+----+---------+--------+--------+------------+
| id | name    | gender | salary | start      |
+----+---------+--------+--------+------------+
|  1 | Bill    | NULL   | 100000 | 2018-01-03 |
|  2 | Terisa  | F      | 200000 | 2019-11-13 |
|  3 | Charlie | NULL   | 300000 | 2020-05-21 |
+----+---------+--------+--------+------------+
3 rows in set (0.00 sec)

UC6:
 update employee_payroll set gender = 'M' where name = 'Bill' or name = 'Charlie';
Query OK, 2 rows affected (0.10 sec)
Rows matched: 2  Changed: 2  Warnings: 0

mysql> SELECT * FROM employee_payroll;
+----+---------+--------+--------+------------+
| id | name    | gender | salary | start      |
+----+---------+--------+--------+------------+
|  1 | Bill    | M      | 100000 | 2018-01-03 |
|  2 | Terisa  | F      | 200000 | 2019-11-13 |
|  3 | Charlie | M      | 300000 | 2020-05-21 |
+----+---------+--------+--------+------------+
3 rows in set (0.00 sec)

UC7:
update employee_payroll set salary = 200000 where name = 'Terisa';
Query OK, 0 rows affected (0.00 sec)
Rows matched: 1  Changed: 0  Warnings: 0

mysql> SELECT * FROM employee_payroll;
+----+---------+--------+--------+------------+
| id | name    | gender | salary | start      |
+----+---------+--------+--------+------------+
|  1 | Bill    | M      | 100000 | 2018-01-03 |
|  2 | Terisa  | F      | 200000 | 2019-11-13 |
|  3 | Charlie | M      | 300000 | 2020-05-21 |
+----+---------+--------+--------+------------+
3 rows in set (0.00 sec)

mysql> SELECT AVG(salary) FROM emplyee_payroll WHERE gender = 'M' GROUP BY gender;
ERROR 1146 (42S02): Table 'payroll_service.emplyee_payroll' doesn't exist
mysql> SELECT AVG(salary) FROM employee_payroll WHERE gender = 'M' GROUP BY gender;
+-------------+
| AVG(salary) |
+-------------+
|      200000 |
+-------------+
1 row in set (0.00 sec)

mysql> SELECT AVG(salary) FROM employee_payroll GROUP BY gender;
+-------------+
| AVG(salary) |
+-------------+
|      200000 |
|      200000 |
+-------------+
2 rows in set (0.05 sec)

mysql> SELECT gender, AVG(salary) FROM employee_payroll GROUP BY gender;
+--------+-------------+
| gender | AVG(salary) |
+--------+-------------+
| M      |      200000 |
| F      |      200000 |
+--------+-------------+
2 rows in set (0.00 sec)

mysql> SELECT gender, COUNT(name) FROM employee_payroll GROUP BY gender;
+--------+-------------+
| gender | COUNT(name) |
+--------+-------------+
| M      |           2 |
| F      |           1 |
+--------+-------------+
2 rows in set (0.00 sec)

mysql> SELECT gender, SUM(salary) FROM employee_payroll GROUP BY gender;
+--------+-------------+
| gender | SUM(salary) |
+--------+-------------+
| M      |      400000 |
| F      |      200000 |
+--------+-------------+
2 rows